<?xml version="1.0" encoding="UTF-8"?>
<Students xmlns:xsi="http://www.w3.org/2001/XMLSchema-instance"
    xsi:noNamespaceSchemaLocation="DBValidate.xsd">
    <Student>
        <StudentName>Nguyen Van A</StudentName>
        <StudentID>SE11111</StudentID>
        <StudentMail>AnvSE11111@fpt.edu.vn</StudentMail>
        <StudentPhone>0123 456 789</StudentPhone>
        <StudentDOB>12/12/2018</StudentDOB>
        <StudentSex>Male</StudentSex>
        <StudentCourse>K11</StudentCourse>
        <StudentGPA>3.4</StudentGPA>
        <Classes>
            <ClassName>IS1104</ClassName>
            <ClassName>IS1105</ClassName>
        </Classes>
        <Subjects>
            <Subject>
                <ClassName>IS1105</ClassName>
                <TeacherID>sonnt5</TeacherID>
                <SubjectID>DBW301</SubjectID>
                <SubjectName>Data warehouse</SubjectName>
                <PT1>5</PT1>
                <PT2>5</PT2>
                <ASS>5</ASS>
                <FinalExam>5</FinalExam>
                <TotalMark>5</TotalMark>    
            </Subject>
            <Subject>
                <ClassName>IS1104</ClassName>
                <TeacherID>AnhBN</TeacherID>
                <SubjectID>PRX301</SubjectID>
                <SubjectName>Web Development (XML)</SubjectName>
                <PT1>5</PT1>
                <PT2>5</PT2>
                <ASS>5</ASS>
                <FinalExam>5</FinalExam>
                <TotalMark>5</TotalMark>    
            </Subject>
            <Subject>
                <ClassName>IS1104</ClassName>
                <TeacherID>anhpn</TeacherID>
                <SubjectID>MLN101</SubjectID>
                <SubjectName>Principles of Marxism - Leninism</SubjectName>
                <PT1>5</PT1>
                <PT2>5</PT2>
                <ASS>5</ASS>
                <FinalExam>5</FinalExam>
                <TotalMark>5</TotalMark>    
            </Subject>
        </Subjects>
    </Student>
    <Student>
        <StudentName>Nguyen Van B</StudentName>
        <StudentID>SE22222</StudentID>
        <StudentMail>AnvSE11111@fpt.edu.vn</StudentMail>
        <StudentPhone>0123 456 789</StudentPhone>
        <StudentDOB>12/12/2018</StudentDOB>
        <StudentSex>Male</StudentSex>
        <StudentCourse>K11</StudentCourse>
        <StudentGPA>3.4</StudentGPA>
        <Classes>
            <ClassName>IS1104</ClassName>
        </Classes>
        <Subjects>
            <Subject>
                <ClassName>IS1104</ClassName>
                <TeacherID>AnhBN</TeacherID>
                <SubjectID>PRX301</SubjectID>
                <SubjectName>Web Development (XML)</SubjectName>
                <PT1>5</PT1>
                <PT2>5</PT2>
                <ASS>5</ASS>
                <FinalExam>5</FinalExam>
                <TotalMark>5</TotalMark>    
            </Subject>
            <Subject>
                <ClassName>IS1104</ClassName>
                <TeacherID>anhpn</TeacherID>
                <SubjectID>MLN101</SubjectID>
                <SubjectName>Principles of Marxism - Leninism</SubjectName>
                <PT1>5</PT1>
                <PT2>5</PT2>
                <ASS>5</ASS>
                <FinalExam>5</FinalExam>
                <TotalMark>5</TotalMark>    
            </Subject>
        </Subjects>
    </Student>
    <Teacher>
        <TeacherID>sonnt5</TeacherID>
        <TeacherName>Ngô Tùng Sơn</TeacherName>
        <Phone>0999999999</Phone>
        <Mail>sonnt69@fe.edu.vn</Mail>
    </Teacher>
    <Teacher>
        <TeacherID>AnhBN</TeacherID>
        <TeacherName>Bùi Ngọc Anh</TeacherName>
        <Phone>0999999999</Phone>
        <Mail>AnhBN5@fe.edu.vn</Mail>
    </Teacher>
    <Teacher>
        <TeacherID>anhpn</TeacherID>
        <TeacherName>Phạm Ngọc Anh</TeacherName>
        <Phone>0999999999</Phone>
        <Mail>AnhPN16@fe.edu.vn</Mail>
    </Teacher>
</Students>